{
  "schemaVersion": "run-state/1",
  "runId": "0x2222222222222222222222222222222222222222222222222222222222222222",
  "checkpoint": {
    "schemaVersion": "strategy-run/2",
    "strategyHash": "0xdddddddddddddddddddddddddddddddddddddddddddddddddddddddddddddddd",
    "runId": "0x2222222222222222222222222222222222222222222222222222222222222222",
    "deploymentRevision": "019a0000-0000-7000-8000-000000000202/3",
    "triggerId": "crossing",
    "sourceEventKey": "chain:10143:0xcccccccccccccccccccccccccccccccccccccccccccccccccccccccccccccccc:4",
    "frames": [
      {
        "ownerId": "crossing",
        "branch": "body",
        "index": 1,
        "iteration": -1
      }
    ],
    "steps": 2,
    "intents": 1,
    "aiCalls": 0,
    "activeMillis": 3,
    "bindings": [],
    "status": "waiting",
    "waiting": {
      "kind": "swap.exactInput",
      "nodeId": "sell_tenth",
      "iterationPath": [],
      "key": "[\"0x2222222222222222222222222222222222222222222222222222222222222222\",\"sell_tenth\",[]]"
    }
  },
  "recorded": {
    "operationKey": "0x1111111111111111111111111111111111111111111111111111111111111111",
    "outcome": "settled",
    "resultRef": "019a0000-0000-7000-8000-000000000301"
  },
  "observationRefs": [
    "019a0000-0000-7000-8000-000000000111"
  ]
}
